Data for May 1, 2023 through May 3, 2023

Name, StationType, County, Longitude, Latitude, Elevation, TotalPrecipitation
BARSTOW-DAGGETT AIRPORT, WBAN, San Bernardino, -116.787, 34.854, 1919, 0.00
SAN DIEGO MONTGOMERY FIELD, WBAN, San Diego, -117.137, 32.815, 418, T
SAN DIEGO INTERNATIONAL AP, WBAN, San Diego, -117.183, 32.734, 15, T
SAN DIEGO MIRAMAR NAS, WBAN, San Diego, -117.133, 32.867, 477, T
NORTH ISLAND NAS, WBAN, San Diego, -117.210, 32.692, 14, T
SAN FRANCISCO INTERNATIONAL AP, WBAN, San Mateo, -122.366, 37.620, 10, 0.01
SAN LUIS OBISPO MCCHESNEY FIELD, WBAN, San Luis Obispo, -120.644, 35.238, 183, T
CEDARVILLE, COOP, Modoc, -120.179, 41.530, 4688, 0.69
CHICO UNIVERSITY FARM, COOP, Butte, -121.821, 39.691, 185, 0.01
CHULA VISTA, COOP, San Diego, -117.086, 32.640, 56, 0.00
CUYAMACA, COOP, San Diego, -116.587, 32.990, 4640, 0.00
DAVIS 2 WSW EXP FARM, COOP, Yolo, -121.776, 38.535, 60, 0.10
DEATH VALLEY NATIONAL PARK, WBAN, Inyo, -116.867, 36.463, -194, 0.00
FORT BRAGG 5 N, COOP, Mendocino, -123.756, 39.510, 123, 0.22
HANFORD 1 S, COOP, Kings, -119.637, 36.316, 237, 0.04
HAPPY CAMP RANGER STATION, COOP, Siskiyou, -123.375, 41.796, 1142, 0.10
LEMON COVE, COOP, Tulare, -119.026, 36.382, 513, 0.00
MERCED MUNICIPAL AP, WBAN, Merced, -120.518, 37.286, 152, 0.00
NAPA STATE HOSPITAL, COOP, Napa, -122.265, 38.278, 35, 0.84
OJAI, COOP, Ventura, -119.227, 34.448, 745, 0.14
ORLAND, COOP, Glenn, -122.200, 39.746, 254, 0.06
ORLEANS, COOP, Humboldt, -123.539, 41.302, 403, 0.06
PASO ROBLES, COOP, San Luis Obispo, -120.685, 35.628, 730, 0.07
PETALUMA AIRPORT, COOP, Sonoma, -122.608, 38.258, 20, 0.03
QUINCY, COOP, Plumas, -120.947, 39.937, 3420, 0.23
REDLANDS, COOP, San Bernardino, -117.195, 34.037, 1410, 0.01
SANTA BARBARA, COOP, Santa Barbara, -119.684, 34.417, 16, 0.00
SANTA ROSA, COOP, Sonoma, -122.713, 38.456, 166, 0.33
TAHOE CITY, COOP, Placer, -120.143, 39.168, 6230, 0.23
WASCO, COOP, Kern, -119.352, 35.589, 291, 0.00
YREKA, COOP, Siskiyou, -122.641, 41.703, 2709, 0.23
EUREKA WFO WOODLEY ISLAND, WBAN, Humboldt, -124.160, 40.810, 20, 0.01
CAMPO, COOP, San Diego, -116.470, 32.626, 2630, 0.00
EL CENTRO 2 SSW, COOP, Imperial, -115.562, 32.767, -30, 0.00
IMPERIAL COUNTY AP, WBAN, Imperial, -115.577, 32.835, -55, 0.00
LAKESIDE 2 E, COOP, San Diego, -116.895, 32.854, 690, 0.00
CARLSBAD MCCLELLAN PALOMAR AP, WBAN, San Diego, -117.277, 33.130, 313, T
HENSHAW DAM, COOP, San Diego, -116.761, 33.237, 2700, 0.00
OCEANSIDE MARINA, COOP, San Diego, -117.395, 33.210, 10, 0.00
BORREGO DESERT PARK, COOP, San Diego, -116.404, 33.256, 810, 0.00
PALOMAR MTN OBSERVATORY, COOP, San Diego, -116.840, 33.378, 5550, 0.00
BLYTHE ASOS, WBAN, Riverside, -114.715, 33.619, 395, 0.00
DESERT RESORTS REGIONAL AP, WBAN, Riverside, -116.164, 33.632, -118, 0.00
SANTA ANA JOHN WAYNE AP, WBAN, Orange, -117.867, 33.680, 43, 0.03
HAYFIELD PUMPING PLANT, COOP, Riverside, -115.629, 33.704, 1370, 0.00
EAGLE MOUNTAIN, COOP, Riverside, -115.451, 33.808, 973, 0.00
LONG BEACH DAUGHERTY AP, WBAN, Los Angeles, -118.147, 33.812, 34, 0.08
FULLERTON MUNICIPAL AP, WBAN, Orange, -117.986, 33.872, 86, 0.03
MARCH AFB, WBAN, Riverside, -117.250, 33.900, 1536, 0.00
HAWTHORNE MUNICIPAL AP, WBAN, Los Angeles, -118.333, 33.924, 55, 0.02
LOS ANGELES INTL AP, WBAN, Los Angeles, -118.387, 33.938, 97, 0.04
RIVERSIDE FIRE STATION 3, COOP, Riverside, -117.388, 33.951, 840, 0.00
RIVERSIDE MUNICIPAL AP, WBAN, Riverside, -117.435, 33.953, 845, 0.02
CHINO AP, WBAN, San Bernardino, -117.625, 33.976, 636, T
CULVER CITY, COOP, Los Angeles, -118.414, 34.005, 92, 0.11
SANTA MONICA MUNICIPAL AP, WBAN, Los Angeles, -118.447, 34.021, 175, 0.04
ONTARIO INTL AP, WBAN, San Bernardino, -117.577, 34.053, 924, 0.02
SAN GABRIEL CANYON PH, COOP, Los Angeles, -117.908, 34.155, 744, 0.21
VAN NUYS AP, WBAN, Los Angeles, -118.491, 34.212, 785, T
CAMARILLO AP, WBAN, Ventura, -119.088, 34.211, 71, T
OXNARD VENTURA COUNTY AP, WBAN, Ventura, -119.204, 34.200, 39, 0.00
BIG BEAR LAKE, COOP, San Bernardino, -116.917, 34.243, 6753, 0.00
SANTA BARBARA MUNI AP, WBAN, Santa Barbara, -119.842, 34.424, 8, 0.00
VICTORVILLE, COOP, San Bernardino, -117.293, 34.529, 2880, 0.00
SAUGUS POWER PLANT 1, COOP, Los Angeles, -118.454, 34.590, 2161, 0.03
CACHUMA LAKE, COOP, Santa Barbara, -119.982, 34.582, 789, 0.00
PALMDALE AP, WBAN, Los Angeles, -118.083, 34.629, 2509, 0.00
LOMPOC AP, WBAN, Santa Barbara, -120.467, 34.667, 88, 0.00
LANCASTER, WBAN, Los Angeles, -118.213, 34.741, 2338, 0.00
SANDBERG, WBAN, Los Angeles, -118.725, 34.744, 4510, 0.00
BAKERSFIELD AP, WBAN, Kern, -119.055, 35.434, 490, 0.00
BUTTONWILLOW, COOP, Kern, -119.470, 35.403, 225, 0.00
TRONA, COOP, San Bernardino, -117.391, 35.764, 1695, 0.00
KETTLEMAN CITY, COOP, Kings, -119.960, 36.007, 240, 0.00
KING CITY, COOP, Monterey, -121.138, 36.207, 320, 0.05
LINDSAY, COOP, Tulare, -119.054, 36.203, 435, 0.01
BIG SUR STATION, COOP, Monterey, -121.780, 36.247, 200, 1.43
VISALIA, COOP, Tulare, -119.300, 36.328, 303, 0.03
PINNACLES NATIONAL PARK, COOP, San Benito, -121.182, 36.482, 1307, 0.03
LODGEPOLE, COOP, Tulare, -118.732, 36.604, 6735, 0.20
MONTEREY, COOP, Monterey, -121.855, 36.593, 122, 0.21
SALINAS AP, WBAN, Monterey, -121.609, 36.664, 73, 0.02
GRANT GROVE, COOP, Tulare, -118.962, 36.738, 6580, 0.04
WATSONVILLE WATERWORKS, COOP, Santa Cruz, -121.769, 36.931, 95, 0.00
FRIANT GOVERNMENT CAMP, COOP, Fresno, -119.707, 36.997, 410, 0.02
GILROY, COOP, Santa Clara, -121.561, 37.003, 194, 0.05
LOS BANOS, COOP, Merced, -120.867, 37.056, 120, 0.12
NORTH FORK RS, COOP, Madera, -119.510, 37.233, 2645, 0.01
MOUNT HAMILTON, WBAN, Santa Clara, -121.635, 37.343, 4220, 0.06
BISHOP AIRPORT, WBAN, Inyo, -118.359, 37.371, 4110, 0.00
REDWOOD CITY, COOP, San Mateo, -122.239, 37.477, 31, 0.03
HALF MOON BAY, COOP, San Mateo, -122.443, 37.473, 27, 0.36
SO ENTRANCE YOSEMITE N.P., COOP, Mariposa, -119.633, 37.512, 5047, 0.00
MODESTO AP, WBAN, Stanislaus, -120.955, 37.625, 87, 0.00
HAYWARD AIR TERMINAL, WBAN, Alameda, -122.121, 37.659, 31, 0.03
LIVERMORE MUNICIPAL AP, WBAN, Alameda, -121.815, 37.693, 393, 0.04
OAKLAND INTERNATIONAL AIRPORT, WBAN, Alameda, -122.233, 37.718, 5, T
SAN FRANCISCO DOWNTOWN, WBAN, San Francisco, -122.427, 37.771, 150, 0.00
TRACY PUMPING PLANT, COOP, Alameda, -121.583, 37.796, 61, 0.16
OAKLAND MUSEUM, COOP, Alameda, -122.264, 37.798, 30, 0.00
STOCKTON AP, WBAN, San Joaquin, -121.226, 37.890, 27, 0.00
RICHMOND, COOP, Contra Costa, -122.377, 37.919, 20, 0.00
SONORA, COOP, Tuolumne, -120.387, 37.967, 1675, 0.07
CONCORD BUCHANAN FIELD, WBAN, Contra Costa, -122.053, 37.992, 23, T
SAN RAFAEL-CIVIC CENTER, COOP, Marin, -122.537, 37.998, 120, 0.00
KENTFIELD, COOP, Marin, -122.545, 37.957, 145, 0.04
SAN ANDREAS 2, COOP, Calaveras, -120.671, 38.191, 1100, 0.01
NAPA COUNTY AIRPORT, WBAN, Napa, -122.280, 38.208, 16, 0.20
SUTTER HILL CDF, COOP, Amador, -120.801, 38.377, 1586, 0.20
SACRAMENTO AP ASOS, WBAN, Sacramento, -121.496, 38.507, 19, T
WINTERS, WBAN, Yolo, -121.978, 38.525, 135, 0.00
LAKE SOLANO, COOP, Solano, -122.004, 38.492, 187, 0.21
SACRAMENTO 5 ESE, WBAN, Sacramento, -121.418, 38.555, 38, 0.02
CALISTOGA, COOP, Napa, -122.578, 38.577, 350, 0.28
SACRAMENTO METROPOLITAN AP, WBAN, Sacramento, -121.595, 38.701, 24, T
MIDDLETOWN, COOP, Lake, -122.626, 38.748, 1121, 0.00
CLOVERDALE, COOP, Sonoma, -123.026, 38.793, 400, 0.00
SOUTH LAKE TAHOE AP, WBAN, El Dorado, -119.996, 38.898, 6257, 0.13
GEORGETOWN RS, COOP, El Dorado, -120.801, 38.933, 3001, 0.52
AUBURN, COOP, Placer, -121.084, 38.907, 1292, 0.08
MARYSVILLE AIRPORT (ASOS), WBAN, Yuba, -121.569, 39.102, 62, T
UKIAH MUNICIPAL AP, WBAN, Mendocino, -123.200, 39.128, 603, 0.36
GRASS VALLEY NO. 2, COOP, Nevada, -121.068, 39.204, 2400, 0.05
BLUE CANYON NYACK AP, WBAN, Placer, -120.709, 39.276, 5286, 0.06
NEVADA CITY, COOP, Nevada, -121.001, 39.247, 2781, 0.10
TRUCKEE AIRPORT, WBAN, Nevada, -120.139, 39.320, 5900, 0.15
BOCA, COOP, Nevada, -120.094, 39.389, 5575, 0.25
POTTER VALLEY POWERHOUSE, COOP, Mendocino, -123.129, 39.362, 1018, 0.47
OROVILLE MUNICIPAL AP, WBAN, Butte, -121.622, 39.494, 187, 0.00
STONY GORGE RESERVOIR, COOP, Glenn, -122.534, 39.586, 800, 0.54
PORTOLA, COOP, Plumas, -120.472, 39.805, 4850, 0.00
COLEMAN FISHERIES STATION, COOP, Shasta, -122.143, 40.400, 420, 0.16
SCOTIA, COOP, Humboldt, -124.104, 40.483, 136, 0.02
WHISKEYTOWN RESERVOIR, COOP, Shasta, -122.528, 40.612, 1295, 0.22
SHASTA DAM, COOP, Shasta, -122.416, 40.714, 1075, 0.11
WILLOW CREEK 1 NW, COOP, Humboldt, -123.636, 40.947, 464, 0.06
DUNSMUIR TREATMENT PL, COOP, Siskiyou, -122.282, 41.183, 2169, 0.40
JESS VALLEY, COOP, Modoc, -120.298, 41.271, 5319, 0.00
MCCLOUD, COOP, Siskiyou, -122.138, 41.252, 3233, 0.30
FORT JONES RS, COOP, Siskiyou, -122.848, 41.601, 2729, 0.16
CRESCENT CITY MCNAMARA AP, WBAN, Del Norte, -124.238, 41.784, 56, T
TULELAKE, COOP, Siskiyou, -121.474, 41.960, 4038, 0.30
BARSTOW, COOP, San Bernardino, -117.022, 34.893, 2220, 0.00
EL CAJON, COOP, San Diego, -116.928, 32.801, 495, 0.00
MARKLEY COVE, COOP, Napa, -122.124, 38.492, 480, 0.28
SUSANVILLE 2SW, WBAN, Lassen, -120.663, 40.417, 4212, 0.00
BURBANK GLENDALE PASADENA AP, WBAN, Los Angeles, -118.365, 34.200, 731, 0.05
MOUNT SHASTA, COOP, Siskiyou, -122.317, 41.322, 3613, 0.20
WATSONVILLE MUNICIPAL AIRPORT, WBAN, Santa Cruz, -121.790, 36.939, 162, 0.08
SANTA ROSA SONOMA CO AP, WBAN, Sonoma, -122.811, 38.504, 119, 0.05
HEARST CASTLE, COOP, San Luis Obispo, -121.168, 35.684, 1526, 0.00
OCOTILLO WELLS 2W, COOP, San Diego, -116.169, 33.155, 390, 0.00
IRVINE RANCH, COOP, Orange, -117.723, 33.720, 540, 0.00
TORRANCE AP, WBAN, Los Angeles, -118.342, 33.802, 90, 0.00
LOS ANGELES DOWNTOWN/USC, WBAN, Los Angeles, -118.291, 34.024, 179, 0.04
FRESNO YOSEMITE INT'L, WBAN, Fresno, -119.720, 36.780, 334, T
MONTEREY PENINSUL AP, WBAN, Monterey, -121.849, 36.590, 160, 0.21
PASO ROBLES MUNICIPAL AP, WBAN, San Luis Obispo, -120.629, 35.669, 820, 0.04
MONTAGUE SISKIYOU AIRPORT, WBAN, Siskiyou, -122.468, 41.774, 2645, T
SAN JOSE, WBAN, Santa Clara, -121.924, 37.359, 49, 0.04
PALM SPRINGS ASOS, WBAN, Riverside, -116.504, 33.822, 409, 0.00
SAN DIEGO BROWN FIELD, WBAN, San Diego, -116.994, 32.576, 521, 0.00
Bakersfield Area, ThreadEx, -, -, -, -, 0.00
Bishop Area, ThreadEx, -, -, -, -, 0.00
Los Angeles Downtown Area, ThreadEx, -, -, -, -, 0.04
Eureka Area, ThreadEx, -, -, -, -, 0.01
Fresno Area, ThreadEx, -, -, -, -, T
Los Angeles Airport Area, ThreadEx, -, -, -, -, 0.04
Long Beach Area, ThreadEx, -, -, -, -, 0.08
Redding Area, ThreadEx, -, -, -, -, 0.00
Sacramento Area, ThreadEx, -, -, -, -, T
San Diego Area, ThreadEx, -, -, -, -, T
Stockton Area, ThreadEx, -, -, -, -, 0.00
San Francisco Airport Area, ThreadEx, -, -, -, -, 0.01
Santa Maria Area, ThreadEx, -, -, -, -, 0.00
CHIRIACO SUMMIT, COOP, Riverside, -115.721, 33.662, 1706, 0.00
YUCCA MESA, COOP, San Bernardino, -116.407, 34.218, 3445, 0.00
JOHNSON VALLEY, COOP, San Bernardino, -116.538, 34.359, 3167, 0.00
MORONGO VALLEY NORTH, COOP, San Bernardino, -116.562, 34.086, 3145, 0.00
TAHOMA, COOP, El Dorado, -120.129, 39.060, 6315, 0.17
CORONA MUNICIPAL AIRPORT, WBAN, Riverside, -117.602, 33.898, 533, 0.02
VERDI 2W, COOP, Sierra, -120.027, 39.521, 5429, 0.00
MCOLF CAMP PENDLETON RED BEACH AIRPORT, WBAN, San Diego, -117.456, 33.286, 89, T
SOUTH LAKE F.S, COOP, Kern, -118.361, 35.647, 2654, 0.00
Burbank Glendale Pasadena Area, ThreadEx, -, -, -, -, 0.05
Camarillo Area, ThreadEx, -, -, -, -, T
Needles Area, ThreadEx, -, -, -, -, 0.00
Palm Springs Area, ThreadEx, -, -, -, -, 0.00
Riverside Area, ThreadEx, -, -, -, -, 0.02
Ramona Area, ThreadEx, -, -, -, -, 0.01
LONG VALLEY 2, COOP, Riverside, -116.642, 33.813, 8380, 0.00
VALLEY CENTER 1N, COOP, San Diego, -117.038, 33.222, 1290, 0.04
Northern CA 8 Station Index, null, -, -, -, -, 0.00
San Joaquin 5 Station Index, null, -, -, -, -, 0.00
Tulare 6 Station Index, null, -, -, -, -, 0.00
Crescent City Area, ThreadEx, -, -, -, -, T
Tahoe City Area, ThreadEx, -, -, -, -, 0.23
Ukiah Area, ThreadEx, -, -, -, -, 0.36
Alturas Area, ThreadEx, -, -, -, -, 0.04
Mount Shasta Area, ThreadEx, -, -, -, -, T
Palmdale Area, ThreadEx, -, -, -, -, 0.00
Lancaster Area, ThreadEx, -, -, -, -, 0.00
El Cajon Area, ThreadEx, -, -, -, -, 0.00
Hanford Area, ThreadEx, -, -, -, -, 0.03
El Centro Area, ThreadEx, -, -, -, -, 0.00
Madera Area, ThreadEx, -, -, -, -, 0.00
Merced Area, ThreadEx, -, -, -, -, 0.00
San Jose Area, ThreadEx, -, -, -, -, 0.04
MODESTO IRRIGATION DISTRICT, COOP, Stanislaus, -120.003, 37.644, 88, 0.00
ALTURAS 9 ENE, COOP, Modoc, -120.364, 41.515, 5307, 0.80
LORAINE 5 NNE, COOP, Kern, -118.412, 35.384, 4235, 0.00
LEE VINING, COOP, Mono, -119.119, 37.957, 6797, T
ANAHEIM, COOP, Orange, -117.842, 33.865, 235, 0.02
NEW MELONES DAM HQ, COOP, Tuolumne, -120.486, 38.005, 960, 0.08
FREMONT, COOP, Alameda, -122.016, 37.542, 38, 0.19
TEHACHAPI 4 SE, COOP, Kern, -118.422, 35.101, 4220, 0.00
VALLEJO, COOP, Solano, -122.187, 38.100, 341, 0.00
HANFORD MUNICIPAL AP, WBAN, Kings, -119.623, 36.311, 249, 0.03
RAMONA AIRPORT, WBAN, San Diego, -116.916, 33.038, 1385, 0.01
VACAVILLE/NUT TREE AP ASOS, WBAN, Solano, -121.959, 38.378, 104, 0.15
ALTURAS MUNICIPAL AP, WBAN, Modoc, -120.561, 41.484, 4383, 0.04
MADERA MUNICIPAL AP, WBAN, Madera, -120.111, 36.985, 251, 0.00
BAKERSFIELD 5 NW, COOP, Kern, -119.051, 35.419, 470, 0.00
FRESNO 5 NE, COOP, Fresno, -119.709, 36.767, 338, 0.00
OCEANSIDE MUNICIPAL AP, WBAN, San Diego, -117.350, 33.219, 30, T
ARCATA EUREKA AP, WBAN, Humboldt, -124.105, 40.978, 211, 0.06
NEWPORT BEACH HARBOR, WBAN, Orange, -117.884, 33.603, 10, 0.00
REDDING AP, WBAN, Shasta, -122.298, 40.515, 501, 0.00
AVALON CATALINA AP, WBAN, Los Angeles, -118.415, 33.404, 1565, 0.01
SANTA MARIA PUBLIC AP, WBAN, Santa Barbara, -120.452, 34.894, 243, 0.00
MOUNT SHASTA, WBAN, Siskiyou, -122.333, 41.333, 3535, T
RED BLUFF MUNI AP, WBAN, Tehama, -122.255, 40.152, 354, T
NEEDLES AIRPORT, WBAN, San Bernardino, -114.618, 34.768, 888, 0.00</pre>